<?xml version="1.0" encoding="UTF-8"?>
<?xml-stylesheet type="text/xsl" href="utenti.xsl"?>
<utenti xmlns:xsi="http://www.w3.org/2001/XMLSchema-instance" xsi:schemaLocation=" utenti.xsd">
  
<utente><username>scici</username><password>password</password></utente>
  <utente>
    <username>rondei</username>
    <password>password</password>
  </utente><utente><username>admin</username><password>admin</password></utente></utenti>
